{
  "file": "site-page.webp",
  "title": "doc-kit › a page of the generated site",
  "route": "/#/examples/screen~the-screen",
  "width": 1440,
  "height": 900,
  "version": "0.1.0",
  "captured": "2026-10-01",
  "zones": [
    {
      "n": 1,
      "x": 15.68,
      "y": 0.66,
      "w": 49.75,
      "h": 5.01,
      "label": "Sections"
    },
    {
      "n": 2,
      "x": 72.78,
      "y": 0.72,
      "w": 18.61,
      "h": 4.89,
      "label": "Search"
    },
    {
      "n": 3,
      "x": 92.08,
      "y": 0.72,
      "w": 3.06,
      "h": 4.89,
      "label": "Theme"
    },
    {
      "n": 4,
      "x": 95.83,
      "y": 0.72,
      "w": 3.06,
      "h": 4.89,
      "label": "Print"
    },
    {
      "n": 5,
      "x": 0,
      "y": 6.67,
      "w": 20.14,
      "h": 93.33,
      "side": "corner",
      "label": "Menu"
    },
    {
      "n": 6,
      "x": 60.57,
      "y": 14.76,
      "w": 12.42,
      "h": 4.44,
      "label": "Guided tour"
    },
    {
      "n": 7,
      "x": 23.4,
      "y": 19.65,
      "w": 57.36,
      "h": 42.04,
      "label": "Annotated screen"
    },
    {
      "n": 8,
      "x": 84.03,
      "y": 6.67,
      "w": 15.97,
      "h": 93.33,
      "label": "On this page"
    }
  ]
}
